{
  "schemaVersion": "2.0",
  "generator": {
    "name": "ui-contract",
    "version": "1.0"
  },
  "page": {
    "formId": 205,
    "name": "Tmp_BaselineB",
    "prefabPath": "Assets/ShareResource/UI/Screens/Tmp_BaselineB.prefab",
    "prefabGuid": "cbb23dba0ffd4b54fb9a54e7bf6e7faf",
    "luaPath": null,
    "layer": 2,
    "fullScreen": true,
    "cacheStrategy": "Lru"
  },
  "controls": [],
  "text": [],
  "styles": [],
  "templates": [
    {
      "nodePath": "Cot_Baseline",
      "template": "Tmp_Baseline",
      "bindingHash": "5d2b1a4f79c79e02d6c5941ce1b569eae836500288d63d5e159de37e8d9e002f"
    }
  ],
  "events": [],
  "sourceHash": "sha256:ffdf50f9d034a9d7c507b36c56396b0ea0f0e8e3583cd97613a728f191d82850"
}
